{"schema":"glasswyrm.m13-scale-client.v1","byte_order":"little","window":4194305,"logical_geometry":{"width":320,"height":240},"buffer_geometry":{"width":640,"height":480},"initial":{"primary":256,"preferred":[1,1],"memberships":[256]},"output":{"id":14600366843002893318,"logical":[640,480],"physical":[640,480],"scale":[1,1]},"notification":{"reasons":3,"primary":259},"moved":{"primary":259,"preferred":[5,4],"memberships":[259]},"present_serial":1,"reset_scale":1}
